{
  "version": "1.0.0",
  "defaults": {
    "command": "sonnet",
    "task": "sonnet",
    "tool": "haiku"
  },
  "modelAliases": {
    "opus": "claude-opus-4-6-20251101",
    "sonnet": "claude-sonnet-4-20250514",
    "haiku": "claude-3-5-haiku-20241022"
  },
  "commandOverrides": {
    "ensemble:create-prd": "opus",
    "ensemble:refine-prd": "opus",
    "ensemble:create-trd": "opus",
    "ensemble:refine-trd": "opus"
  },
  "costTracking": {
    "enabled": true,
    "logPath": "~/.config/ensemble/logs/model-usage.jsonl"
  }
}
